filename,filepath,description
istockphoto-637518486-612x612.jpg,C:\Users\admin\Documents\SUTD\CDS\50.038-Group-17-Final-Project\preprocessing\scripts\..\data\raw\images\istockphoto-637518486-612x612.jpg,"View on modern skyscrapers and busy evening highways in luxury Dubai city,Dubai,United Arab Emirates"
istockphoto-638510810-612x612.jpg,C:\Users\admin\Documents\SUTD\CDS\50.038-Group-17-Final-Project\preprocessing\scripts\..\data\raw\images\istockphoto-638510810-612x612.jpg,"Young woman in an alley of the ancient village of fenghuang, China taking a selfie portrait."
istockphoto-638807176-612x612.jpg,C:\Users\admin\Documents\SUTD\CDS\50.038-Group-17-Final-Project\preprocessing\scripts\..\data\raw\images\istockphoto-638807176-612x612.jpg,Young woman on top of the Great Wall of China arms outstretched for freedom and positive emotions. Contemplating the beautiful landscape from high up.
istockphoto-652717318-612x612.jpg,C:\Users\admin\Documents\SUTD\CDS\50.038-Group-17-Final-Project\preprocessing\scripts\..\data\raw\images\istockphoto-652717318-612x612.jpg,"Camaguey, Cuba, December 19, 2016: Some tourists and locals on the Plaza de los Trabajadores square in the center of Camaguey."
istockphoto-832443436-612x612.jpg,C:\Users\admin\Documents\SUTD\CDS\50.038-Group-17-Final-Project\preprocessing\scripts\..\data\raw\images\istockphoto-832443436-612x612.jpg,"The Hattusa that is The capital of the Hittite Civilization, Corum"
istockphoto-857278564-612x612.jpg,C:\Users\admin\Documents\SUTD\CDS\50.038-Group-17-Final-Project\preprocessing\scripts\..\data\raw\images\istockphoto-857278564-612x612.jpg,"Young traveler standing in front of temple of heaven - in Beijing, China. Asia Travel"
istockphoto-860594926-612x612.jpg,C:\Users\admin\Documents\SUTD\CDS\50.038-Group-17-Final-Project\preprocessing\scripts\..\data\raw\images\istockphoto-860594926-612x612.jpg,"Chinese house in the mountains.,3d render"
istockphoto-899508826-612x612.jpg,C:\Users\admin\Documents\SUTD\CDS\50.038-Group-17-Final-Project\preprocessing\scripts\..\data\raw\images\istockphoto-899508826-612x612.jpg,The Great Wall of China.
istockphoto-90370513-612x612.jpg,C:\Users\admin\Documents\SUTD\CDS\50.038-Group-17-Final-Project\preprocessing\scripts\..\data\raw\images\istockphoto-90370513-612x612.jpg,
istockphoto-904340796-612x612.jpg,C:\Users\admin\Documents\SUTD\CDS\50.038-Group-17-Final-Project\preprocessing\scripts\..\data\raw\images\istockphoto-904340796-612x612.jpg,"High Atlas Mountains in the north part of Africa, landscape of Middle Atlas Mountains"
istockphoto-909154638-612x612.jpg,C:\Users\admin\Documents\SUTD\CDS\50.038-Group-17-Final-Project\preprocessing\scripts\..\data\raw\images\istockphoto-909154638-612x612.jpg,It's a public space. No intellectual property issue.
istockphoto-912128734-612x612.jpg,C:\Users\admin\Documents\SUTD\CDS\50.038-Group-17-Final-Project\preprocessing\scripts\..\data\raw\images\istockphoto-912128734-612x612.jpg,"Aerial view of 432 Park Avenue construction, the tallest residential building in the world, in New york City"
istockphoto-914462430-612x612.jpg,C:\Users\admin\Documents\SUTD\CDS\50.038-Group-17-Final-Project\preprocessing\scripts\..\data\raw\images\istockphoto-914462430-612x612.jpg,cityscape of paris by the sunset
istockphoto-915247608-612x612.jpg,C:\Users\admin\Documents\SUTD\CDS\50.038-Group-17-Final-Project\preprocessing\scripts\..\data\raw\images\istockphoto-915247608-612x612.jpg,Tourist resort in Aqaba Jordan where all the ferries from Egypt land
istockphoto-928047946-612x612.jpg,C:\Users\admin\Documents\SUTD\CDS\50.038-Group-17-Final-Project\preprocessing\scripts\..\data\raw\images\istockphoto-928047946-612x612.jpg,Colonial buildings in colonial town of Sucre - Bolivia
istockphoto-928048678-612x612.jpg,C:\Users\admin\Documents\SUTD\CDS\50.038-Group-17-Final-Project\preprocessing\scripts\..\data\raw\images\istockphoto-928048678-612x612.jpg,Rooftop view from San Felipe de Neri
istockphoto-936601812-612x612.jpg,C:\Users\admin\Documents\SUTD\CDS\50.038-Group-17-Final-Project\preprocessing\scripts\..\data\raw\images\istockphoto-936601812-612x612.jpg,"Rani ki vav, an intricately constructed stepwell in Patan. A UNESCO world heritage site in Gujarat, India"
istockphoto-961742934-612x612.jpg,C:\Users\admin\Documents\SUTD\CDS\50.038-Group-17-Final-Project\preprocessing\scripts\..\data\raw\images\istockphoto-961742934-612x612.jpg,"Singapore - May 2, 2018: Sentosa Bull Ring square with Universal Studios world globe in a rainbow at sunset. Famous place for holidays.Universal Studios is the first Hollywood movie theme park in Asia"
istockphoto-97362833-612x612.jpg,C:\Users\admin\Documents\SUTD\CDS\50.038-Group-17-Final-Project\preprocessing\scripts\..\data\raw\images\istockphoto-97362833-612x612.jpg,
istockphoto-993777046-612x612.jpg,C:\Users\admin\Documents\SUTD\CDS\50.038-Group-17-Final-Project\preprocessing\scripts\..\data\raw\images\istockphoto-993777046-612x612.jpg,"MUMBAI, INDIA - JUNE 24, 2018 : A famous black & yellow collored taxi running on the streets of Mumbai opposite CST station"
